{
  "classification": "locator-stale",
  "confidence": 0.7,
  "summary": "Expected element to be visible but it was not found. Selector may be stale.",
  "evidence": [
    "toBeVisible assertion failed",
    "Button/link locator may have changed — check with ?wb_inspect=1"
  ],
  "suspected_files": [],
  "recommended_action": "Run the page with ?wb_inspect=1 and update data-wb-action selectors.",
  "safe_to_auto_heal": false,
  "module": "project-audit-ledger",
  "run_context": {
    "total_tests": 1,
    "passed": 0,
    "failed": 1,
    "skipped": 0,
    "timedOut": 0,
    "issues": 2
  },
  "failed_test": {
    "file": "/var/www/html/applicationostest/tests/browser/modules/pal/workflows/pal-lifecycle-interactive.spec.js",
    "test": "JO operational setup: draft → ongoing",
    "error": "Error: Approval row for E2E-1783954604127-Project must exist\n\n\u001b[2mexpect(\u001b[22m\u001b[31mlocator\u001b[39m\u001b[2m).\u001b[22mtoBeVisible\u001b[2m(\u001b[22m\u001b[2m)\u001b[22m failed\n\nLocator: locator('[data-wb-entity-type=\"project\"]').filter({ hasText: 'E2E-1783954604127-Project' }).first()\nExpected: visible\nTimeout: 8000ms\nError: elem"
  }
}